agent_index,agent_role,avg_choice_A_prob,avg_choice_B_prob,avg_choice_C_prob,avg_variance,avg_entropy,avg_gini,avg_uniform_kl,questions_processed
1,You are an excellent judge with strong critical thinking skills,0.3404285714285715,0.3418571428571429,0.3177142857142856,0.008095555555555557,1.5332345633427558,0.1143809523809524,0.051727937378401256,70
2,You are a knowledgeable and caring doctor,0.3228571428571429,0.32857142857142857,0.33142857142857135,0.016222222222222218,1.4826244559955115,0.14783068783068784,0.10233804472564519,70
3,You are a practical engineer,0.3271428571428572,0.3271428571428571,0.3357142857142857,0.01895238095238095,1.4663003918233872,0.1580952380952381,0.11866210889776958,70
4,You are a precise lawyer,0.3071428571428572,0.32142857142857145,0.3628571428571428,0.01784126984126983,1.4725478111366905,0.15428571428571433,0.1124146895844661,70
5,You are a clever merchant,0.3157142857142858,0.31142857142857144,0.3671428571428571,0.02447619047619047,1.4299816965632102,0.18497354497354496,0.15498080415794654,70
6,You are a talented summarizer with excellent synthesis abilities,0.2871428571428572,0.3,0.4028571428571429,0.039714285714285716,1.3341997731720483,0.23999999999999996,0.25043738049864483,70
